{
  "schema_version": "1.6",
  "dataset_id": "curated-dev-v1.6",
  "profiles": [
    {
      "profile_id": "tol_narrow_1",
      "profile_level": "narrow",
      "residue_flexibility_bin": "medium",
      "pocket_depth_bin": "shallow",
      "coordinate_noise_level": "low",
      "generated_by_fixture_calibration": true
    },
    {
      "profile_id": "tol_standard_1",
      "profile_level": "standard",
      "residue_flexibility_bin": "medium",
      "pocket_depth_bin": "shallow",
      "coordinate_noise_level": "low",
      "generated_by_fixture_calibration": true
    },
    {
      "profile_id": "tol_relaxed_1",
      "profile_level": "relaxed",
      "residue_flexibility_bin": "medium",
      "pocket_depth_bin": "shallow",
      "coordinate_noise_level": "low",
      "generated_by_fixture_calibration": true
    }
  ],
  "positive_recall": 0.95,
  "hard_negative_rejection": 0.98,
  "bucket_occupancy_p95": 3.0,
  "seed_triplets_p95": 8.0,
  "max_seed_triplets_observed": 10,
  "peak_memory_mb": 4.5,
  "runtime_ms_per_fixture": 12.0,
  "oom_risk_score": 0.1
}
